{
  "terrains": [
    {
      "id": "FIELDS",
      "display_name": "Fields",
      "glyph": "\"",
      "color": "#8f9a4f",
      "can_be_base": true,
      "needs_bridge": false,
      "move_cost": 1.0,
      "blocks_unit_classes": [],
      "bearing": 4,
      "default_elevation": 2,
      "relief_amplitude": 1,
      "relief_scale": 12,
      "foundation_max": 8,
      "dig_depth": 32,
      "liquids": [
        {
          "material_id": "WATER",
          "min_cells": 12,
          "max_cells": 24,
          "chance": 1.0,
          "surface_chance": 0.02
        }
      ],
      "strata": [
        {
          "material_id": "SOIL",
          "min_cells": 2,
          "max_cells": 4
        },
        {
          "material_id": "CLAY",
          "min_cells": 4,
          "max_cells": 8
        },
        {
          "material_id": "ROCK",
          "min_cells": 8,
          "max_cells": 16
        }
      ],
      "default_stability": 4,
      "default_max_height": 2,
      "default_max_width": 3,
      "default_max_length": 3,
      "default_max_depth": 1
    },
    {
      "id": "ROCKY",
      "display_name": "Rocky",
      "glyph": "◦",
      "color": "#857d6e",
      "can_be_base": true,
      "needs_bridge": false,
      "move_cost": 1.5,
      "blocks_unit_classes": [],
      "bearing": 8,
      "default_elevation": 6,
      "relief_amplitude": 2,
      "relief_scale": 4,
      "foundation_max": 12,
      "dig_depth": 32,
      "liquids": [
        {
          "material_id": "WATER",
          "min_cells": 16,
          "max_cells": 32,
          "chance": 1.0,
          "surface_chance": 0.0
        },
        {
          "material_id": "LAVA",
          "min_cells": 32,
          "max_cells": 48,
          "chance": 0.2,
          "surface_chance": 0.02
        }
      ],
      "strata": [
        {
          "material_id": "SOIL",
          "min_cells": 0,
          "max_cells": 1
        },
        {
          "material_id": "ROCK",
          "min_cells": 8,
          "max_cells": 16
        }
      ],
      "default_stability": 6,
      "default_max_height": 3,
      "default_max_width": 2,
      "default_max_length": 2,
      "default_max_depth": 2
    },
    {
      "id": "SNOW",
      "display_name": "Snow",
      "glyph": "*",
      "color": "#8fa3b0",
      "can_be_base": true,
      "needs_bridge": false,
      "move_cost": 2.0,
      "blocks_unit_classes": [],
      "bearing": 3,
      "default_elevation": 8,
      "relief_amplitude": 1,
      "relief_scale": 10,
      "foundation_max": 6,
      "dig_depth": 24,
      "liquids": [],
      "strata": [
        {
          "material_id": "SOIL",
          "min_cells": 1,
          "max_cells": 2
        },
        {
          "material_id": "ROCK",
          "min_cells": 8,
          "max_cells": 16
        }
      ],
      "default_stability": 2,
      "default_max_height": 1,
      "default_max_width": 2,
      "default_max_length": 2,
      "default_max_depth": 0
    },
    {
      "id": "DESERT",
      "display_name": "Desert",
      "glyph": "∴",
      "color": "#c29b52",
      "can_be_base": true,
      "needs_bridge": false,
      "move_cost": 1.5,
      "blocks_unit_classes": [],
      "bearing": 3,
      "default_elevation": 2,
      "relief_amplitude": 2,
      "relief_scale": 12,
      "foundation_max": 6,
      "dig_depth": 32,
      "liquids": [
        {
          "material_id": "WATER",
          "min_cells": 20,
          "max_cells": 32,
          "chance": 0.3,
          "surface_chance": 0.0
        }
      ],
      "strata": [
        {
          "material_id": "SAND",
          "min_cells": 4,
          "max_cells": 10
        },
        {
          "material_id": "ROCK",
          "min_cells": 8,
          "max_cells": 16
        }
      ],
      "default_stability": 3,
      "default_max_height": 1,
      "default_max_width": 3,
      "default_max_length": 3,
      "default_max_depth": 1
    },
    {
      "id": "SWAMP",
      "display_name": "Swamp",
      "glyph": "~",
      "color": "#5d6b4a",
      "can_be_base": true,
      "needs_bridge": false,
      "move_cost": 3.0,
      "blocks_unit_classes": ["siege"],
      "bearing": 2,
      "default_elevation": 0,
      "relief_amplitude": 0,
      "relief_scale": 0,
      "foundation_max": 4,
      "dig_depth": 16,
      "liquids": [
        {
          "material_id": "WATER",
          "min_cells": 0,
          "max_cells": 2,
          "chance": 1.0,
          "surface_chance": 0.5
        }
      ],
      "strata": [
        {
          "material_id": "PEAT",
          "min_cells": 2,
          "max_cells": 4
        },
        {
          "material_id": "CLAY",
          "min_cells": 4,
          "max_cells": 8
        }
      ],
      "default_stability": 1,
      "default_max_height": 1,
      "default_max_width": 1,
      "default_max_length": 1,
      "default_max_depth": 0
    },
    {
      "id": "WATER",
      "display_name": "Water",
      "glyph": "≈",
      "color": "#3a6ea5",
      "can_be_base": false,
      "needs_bridge": true,
      "move_cost": 99.0,
      "blocks_unit_classes": ["infantry", "cavalry", "siege"],
      "bearing": 0,
      "default_elevation": 0,
      "relief_amplitude": 0,
      "relief_scale": 0,
      "foundation_max": 0,
      "dig_depth": 0,
      "liquids": [],
      "strata": [],
      "default_stability": 0,
      "default_max_height": 0,
      "default_max_width": 0,
      "default_max_length": 0,
      "default_max_depth": 0
    },
    {
      "id": "FOREST",
      "display_name": "Forest",
      "glyph": "♣",
      "color": "#2f6b3a",
      "can_be_base": false,
      "needs_bridge": false,
      "move_cost": 2.0,
      "blocks_unit_classes": ["siege"],
      "bearing": 4,
      "default_elevation": 3,
      "relief_amplitude": 1,
      "relief_scale": 8,
      "foundation_max": 8,
      "dig_depth": 32,
      "liquids": [
        {
          "material_id": "WATER",
          "min_cells": 10,
          "max_cells": 20,
          "chance": 1.0,
          "surface_chance": 0.02
        }
      ],
      "strata": [
        {
          "material_id": "SOIL",
          "min_cells": 2,
          "max_cells": 3
        },
        {
          "material_id": "CLAY",
          "min_cells": 3,
          "max_cells": 6
        },
        {
          "material_id": "ROCK",
          "min_cells": 8,
          "max_cells": 16
        }
      ],
      "default_stability": 2,
      "default_max_height": 2,
      "default_max_width": 1,
      "default_max_length": 1,
      "default_max_depth": 1
    },
    {
      "id": "MOUNTAIN",
      "display_name": "Mountain",
      "glyph": "▲",
      "color": "#7a6a5a",
      "can_be_base": false,
      "needs_bridge": false,
      "move_cost": 4.0,
      "blocks_unit_classes": ["cavalry", "siege"],
      "bearing": 8,
      "default_elevation": 64,
      "relief_amplitude": 8,
      "relief_scale": 8,
      "foundation_max": 12,
      "dig_depth": 48,
      "liquids": [
        {
          "material_id": "LAVA",
          "min_cells": 24,
          "max_cells": 48,
          "chance": 0.35,
          "surface_chance": 0.05
        }
      ],
      "strata": [
        {
          "material_id": "SOIL",
          "min_cells": 0,
          "max_cells": 1
        },
        {
          "material_id": "ROCK",
          "min_cells": 16,
          "max_cells": 32
        }
      ],
      "default_stability": 4,
      "default_max_height": 4,
      "default_max_width": 1,
      "default_max_length": 1,
      "default_max_depth": 3
    },
    {
      "id": "RAVINE",
      "display_name": "Ravine",
      "glyph": "∷",
      "color": "#4a3a2a",
      "can_be_base": false,
      "needs_bridge": true,
      "move_cost": 99.0,
      "blocks_unit_classes": ["all"],
      "bearing": 0,
      "default_elevation": 0,
      "relief_amplitude": 0,
      "relief_scale": 0,
      "foundation_max": 0,
      "dig_depth": 0,
      "liquids": [],
      "strata": [],
      "default_stability": 0,
      "default_max_height": 0,
      "default_max_width": 0,
      "default_max_length": 0,
      "default_max_depth": 0
    },
    {
      "id": "HILLY",
      "display_name": "Hilly",
      "glyph": "︵",
      "color": "#aee983",
      "can_be_base": true,
      "needs_bridge": false,
      "move_cost": 2.0,
      "blocks_unit_classes": ["siege", "cavalry"],
      "bearing": 5,
      "default_elevation": 4,
      "relief_amplitude": 4,
      "relief_scale": 6,
      "foundation_max": 10,
      "dig_depth": 32,
      "liquids": [
        {
          "material_id": "WATER",
          "min_cells": 14,
          "max_cells": 28,
          "chance": 1.0,
          "surface_chance": 0.02
        }
      ],
      "strata": [
        {
          "material_id": "SOIL",
          "min_cells": 1,
          "max_cells": 3
        },
        {
          "material_id": "GRAVEL",
          "min_cells": 1,
          "max_cells": 2
        },
        {
          "material_id": "ROCK",
          "min_cells": 8,
          "max_cells": 16
        }
      ],
      "default_stability": 0,
      "default_max_height": 0,
      "default_max_width": 0,
      "default_max_length": 0,
      "default_max_depth": 1
    }
  ],
  "features": [
    {
      "id": "ORE_VEIN",
      "display_name": "Ore vein",
      "glyph": "◆",
      "effect_notes": "metal/stone deposit - a mine could be built here"
    },
    {
      "id": "ARABLE",
      "display_name": "Arable land",
      "glyph": "≡",
      "effect_notes": "supports farming"
    },
    {
      "id": "SPRING",
      "display_name": "Spring",
      "glyph": "○",
      "effect_notes": "fresh water"
    },
    {
      "id": "TIMBER",
      "display_name": "Timber stand",
      "glyph": "♠",
      "effect_notes": "harvestable wood"
    },
    {
      "id": "QUARRY",
      "display_name": "Quarry face",
      "glyph": "▣",
      "effect_notes": "exposed stone"
    },
    {
      "id": "LAVA_VENT",